{"format_version":1,"from_artifact":"artifact:6fbb7fb6748fc14f95970dc301c5bf5cdd3b18d57adbddbdf1002e524618294b","recoveries":[{"deleted":"choice-point:00000000000000000000000000000001","target":{"choice_point":"choice-point:00000000000000000000000000000014","node":"node:00000000000000000000000000000014"}}],"to_artifact":"artifact:48f30a7aa1fe57651628160f738818867b552801a8cb6b0291c6972423949d52"}
