{"format_version":1,"from_artifact":"artifact:6fbb7fb6748fc14f95970dc301c5bf5cdd3b18d57adbddbdf1002e524618294b","recoveries":[{"deleted":"node:00000000000000000000000000000001","target":{"choice_point":"choice-point:00000000000000000000000000000014","node":"node:00000000000000000000000000000014"}},{"deleted":"choice-point:00000000000000000000000000000001","target":{"choice_point":"choice-point:00000000000000000000000000000015","node":"node:00000000000000000000000000000015"}}],"to_artifact":"artifact:c1f2bfa38ecc60c14a3c9efba8cc98d04b31c39fdb28e67eab8072d60b695172"}
