{"format_version":1,"from_artifact":"artifact:6fbb7fb6748fc14f95970dc301c5bf5cdd3b18d57adbddbdf1002e524618294b","recoveries":[{"deleted":"node:00000000000000000000000000000005","target":{"choice_point":"choice-point:00000000000000000000000000000014","node":"node:00000000000000000000000000000014"}}],"to_artifact":"artifact:a27b14257f875b68316c274def0820a6ad85ea41997344cf93893800aa96e87e"}
